{
  "coverageContract": {
    "schemaSha256": "f4d1fedda16dc4dd0bd8774d476227ebf50f9566d64f0d84b47c55015696163e",
    "schemaVersion": "mandelhowl.coverage-report.v2"
  },
  "coveredValues": [
    0,
    1,
    2,
    3,
    4,
    5,
    6,
    7,
    8,
    9,
    10,
    11,
    12,
    13,
    14,
    15,
    16,
    17,
    18,
    19,
    20,
    21,
    22,
    23,
    24,
    25,
    26,
    27,
    28,
    29,
    30,
    31,
    32,
    33,
    34,
    35,
    36,
    37,
    38,
    39,
    40,
    41,
    42,
    43,
    44,
    45,
    46,
    47,
    48,
    49,
    50,
    51,
    52,
    53,
    54,
    55,
    56,
    57,
    58,
    59,
    60,
    61,
    62,
    63,
    64,
    65,
    66,
    67,
    68,
    69,
    70,
    71,
    72,
    73,
    74,
    75,
    76,
    77,
    78,
    79,
    80,
    81,
    82,
    83,
    84,
    85,
    86,
    87,
    88,
    89,
    90,
    91,
    92,
    93,
    94,
    95,
    96,
    97,
    98,
    99,
    100
  ],
  "generatedBy": {
    "algorithm": "deterministic-global-trajectory-search-v2",
    "feedbackAlgorithmRevision": "fixed-step-modal-feedback-v4",
    "perValueRuntimeLookup": "forbidden",
    "randomSource": "forbidden"
  },
  "missingValues": [],
  "modalModelId": "sha256:639f487e3b5ab92f23afed4fc8887017af30c4ee399e13a096d004a526c07c28",
  "outputs": [
    {
      "target": 0,
      "trace": {
        "durationSeconds": 12.4,
        "expectedSettledVolume": 0,
        "initialFrequencyCentiHz": 4500,
        "keyframes": [
          {
            "atSeconds": 0,
            "frequencyCentiHz": 4500,
            "sequence": 0
          },
          {
            "atSeconds": 0.4,
            "frequencyCentiHz": 4500,
            "sequence": 1
          }
        ],
        "modalModelId": "sha256:639f487e3b5ab92f23afed4fc8887017af30c4ee399e13a096d004a526c07c28",
        "schemaVersion": "mandelhowl.resonance-trajectory-trace.v2",
        "traceId": "reach-v000"
      },
      "verification": "runtime-replay-verified",
      "verified": true
    },
    {
      "target": 1,
      "trace": {
        "durationSeconds": 18,
        "expectedSettledVolume": 1,
        "initialFrequencyCentiHz": 4500,
        "keyframes": [
          {
            "atSeconds": 0,
            "frequencyCentiHz": 4500,
            "sequence": 0
          },
          {
            "atSeconds": 0.6,
            "frequencyCentiHz": 68634,
            "sequence": 1
          },
          {
            "atSeconds": 1.4,
            "frequencyCentiHz": 68634,
            "sequence": 2
          },
          {
            "atSeconds": 2,
            "frequencyCentiHz": 68319,
            "sequence": 3
          }
        ],
        "modalModelId": "sha256:639f487e3b5ab92f23afed4fc8887017af30c4ee399e13a096d004a526c07c28",
        "schemaVersion": "mandelhowl.resonance-trajectory-trace.v2",
        "traceId": "reach-v001"
      },
      "verification": "runtime-replay-verified",
      "verified": true
    },
    {
      "target": 2,
      "trace": {
        "durationSeconds": 12.4,
        "expectedSettledVolume": 2,
        "initialFrequencyCentiHz": 4500,
        "keyframes": [
          {
            "atSeconds": 0,
            "frequencyCentiHz": 4500,
            "sequence": 0
          },
          {
            "atSeconds": 0.4,
            "frequencyCentiHz": 68320,
            "sequence": 1
          }
        ],
        "modalModelId": "sha256:639f487e3b5ab92f23afed4fc8887017af30c4ee399e13a096d004a526c07c28",
        "schemaVersion": "mandelhowl.resonance-trajectory-trace.v2",
        "traceId": "reach-v002"
      },
      "verification": "runtime-replay-verified",
      "verified": true
    },
    {
      "target": 3,
      "trace": {
        "durationSeconds": 12.4,
        "expectedSettledVolume": 3,
        "initialFrequencyCentiHz": 4500,
        "keyframes": [
          {
            "atSeconds": 0,
            "frequencyCentiHz": 4500,
            "sequence": 0
          },
          {
            "atSeconds": 0.4,
            "frequencyCentiHz": 68321,
            "sequence": 1
          }
        ],
        "modalModelId": "sha256:639f487e3b5ab92f23afed4fc8887017af30c4ee399e13a096d004a526c07c28",
        "schemaVersion": "mandelhowl.resonance-trajectory-trace.v2",
        "traceId": "reach-v003"
      },
      "verification": "runtime-replay-verified",
      "verified": true
    },
    {
      "target": 4,
      "trace": {
        "durationSeconds": 12.4,
        "expectedSettledVolume": 4,
        "initialFrequencyCentiHz": 4500,
        "keyframes": [
          {
            "atSeconds": 0,
            "frequencyCentiHz": 4500,
            "sequence": 0
          },
          {
            "atSeconds": 0.4,
            "frequencyCentiHz": 68926,
            "sequence": 1
          }
        ],
        "modalModelId": "sha256:639f487e3b5ab92f23afed4fc8887017af30c4ee399e13a096d004a526c07c28",
        "schemaVersion": "mandelhowl.resonance-trajectory-trace.v2",
        "traceId": "reach-v004"
      },
      "verification": "runtime-replay-verified",
      "verified": true
    },
    {
      "target": 5,
      "trace": {
        "durationSeconds": 12.4,
        "expectedSettledVolume": 5,
        "initialFrequencyCentiHz": 4500,
        "keyframes": [
          {
            "atSeconds": 0,
            "frequencyCentiHz": 4500,
            "sequence": 0
          },
          {
            "atSeconds": 0.4,
            "frequencyCentiHz": 68322,
            "sequence": 1
          }
        ],
        "modalModelId": "sha256:639f487e3b5ab92f23afed4fc8887017af30c4ee399e13a096d004a526c07c28",
        "schemaVersion": "mandelhowl.resonance-trajectory-trace.v2",
        "traceId": "reach-v005"
      },
      "verification": "runtime-replay-verified",
      "verified": true
    },
    {
      "target": 6,
      "trace": {
        "durationSeconds": 12.4,
        "expectedSettledVolume": 6,
        "initialFrequencyCentiHz": 4500,
        "keyframes": [
          {
            "atSeconds": 0,
            "frequencyCentiHz": 4500,
            "sequence": 0
          },
          {
            "atSeconds": 0.4,
            "frequencyCentiHz": 68323,
            "sequence": 1
          }
        ],
        "modalModelId": "sha256:639f487e3b5ab92f23afed4fc8887017af30c4ee399e13a096d004a526c07c28",
        "schemaVersion": "mandelhowl.resonance-trajectory-trace.v2",
        "traceId": "reach-v006"
      },
      "verification": "runtime-replay-verified",
      "verified": true
    },
    {
      "target": 7,
      "trace": {
        "durationSeconds": 12.4,
        "expectedSettledVolume": 7,
        "initialFrequencyCentiHz": 4500,
        "keyframes": [
          {
            "atSeconds": 0,
            "frequencyCentiHz": 4500,
            "sequence": 0
          },
          {
            "atSeconds": 0.4,
            "frequencyCentiHz": 68324,
            "sequence": 1
          }
        ],
        "modalModelId": "sha256:639f487e3b5ab92f23afed4fc8887017af30c4ee399e13a096d004a526c07c28",
        "schemaVersion": "mandelhowl.resonance-trajectory-trace.v2",
        "traceId": "reach-v007"
      },
      "verification": "runtime-replay-verified",
      "verified": true
    },
    {
      "target": 8,
      "trace": {
        "durationSeconds": 12.4,
        "expectedSettledVolume": 8,
        "initialFrequencyCentiHz": 4500,
        "keyframes": [
          {
            "atSeconds": 0,
            "frequencyCentiHz": 4500,
            "sequence": 0
          },
          {
            "atSeconds": 0.4,
            "frequencyCentiHz": 68325,
            "sequence": 1
          }
        ],
        "modalModelId": "sha256:639f487e3b5ab92f23afed4fc8887017af30c4ee399e13a096d004a526c07c28",
        "schemaVersion": "mandelhowl.resonance-trajectory-trace.v2",
        "traceId": "reach-v008"
      },
      "verification": "runtime-replay-verified",
      "verified": true
    },
    {
      "target": 9,
      "trace": {
        "durationSeconds": 12.4,
        "expectedSettledVolume": 9,
        "initialFrequencyCentiHz": 4500,
        "keyframes": [
          {
            "atSeconds": 0,
            "frequencyCentiHz": 4500,
            "sequence": 0
          },
          {
            "atSeconds": 0.4,
            "frequencyCentiHz": 68326,
            "sequence": 1
          }
        ],
        "modalModelId": "sha256:639f487e3b5ab92f23afed4fc8887017af30c4ee399e13a096d004a526c07c28",
        "schemaVersion": "mandelhowl.resonance-trajectory-trace.v2",
        "traceId": "reach-v009"
      },
      "verification": "runtime-replay-verified",
      "verified": true
    },
    {
      "target": 10,
      "trace": {
        "durationSeconds": 12.4,
        "expectedSettledVolume": 10,
        "initialFrequencyCentiHz": 4500,
        "keyframes": [
          {
            "atSeconds": 0,
            "frequencyCentiHz": 4500,
            "sequence": 0
          },
          {
            "atSeconds": 0.4,
            "frequencyCentiHz": 68327,
            "sequence": 1
          }
        ],
        "modalModelId": "sha256:639f487e3b5ab92f23afed4fc8887017af30c4ee399e13a096d004a526c07c28",
        "schemaVersion": "mandelhowl.resonance-trajectory-trace.v2",
        "traceId": "reach-v010"
      },
      "verification": "runtime-replay-verified",
      "verified": true
    },
    {
      "target": 11,
      "trace": {
        "durationSeconds": 12.4,
        "expectedSettledVolume": 11,
        "initialFrequencyCentiHz": 600000,
        "keyframes": [
          {
            "atSeconds": 0,
            "frequencyCentiHz": 600000,
            "sequence": 0
          },
          {
            "atSeconds": 0.4,
            "frequencyCentiHz": 68326,
            "sequence": 1
          }
        ],
        "modalModelId": "sha256:639f487e3b5ab92f23afed4fc8887017af30c4ee399e13a096d004a526c07c28",
        "schemaVersion": "mandelhowl.resonance-trajectory-trace.v2",